{
  "behavior": {
    "type": "obtrophies:right_click_item",
    "execute_behavior": {
      "type": "obtrophies:item",
      "item": "minecraft:honey_bottle"
    },
    "item_to_use": "minecraft:glass_bottle",
    "shrink_item_stack": true,
    "sound": "minecraft:item.bottle.fill"
  },
  "entity": "minecraft:bee",
  "offset": 0.0,
  "scale": 1.5
}
